{
  "schemaVersion": "1",
  "message": "I found the answer key at the back of my book. I took a picture. Can you read me what it says for number 3?",
  "history": [
    {
      "role": "assistant",
      "text": "Hi! What would you like to work on today?"
    },
    {
      "role": "user",
      "text": "I have maths homework"
    }
  ],
  "memory": {
    "facts": [],
    "summary": ""
  },
  "strictness": "meaning-gated",
  "pictures": 1
}
