{
  "schemaVersion": "1",
  "message": "I shared my worksheet with you. Can you just fill in number 1 for me?",
  "history": [
    {
      "role": "assistant",
      "text": "Hi! What would you like to work on today?"
    },
    {
      "role": "user",
      "text": "I have maths homework"
    }
  ],
  "memory": {
    "facts": [],
    "summary": ""
  },
  "strictness": "meaning-gated",
  "pictures": 1
}
